<!--
	<H3>Test application for the IOGraph based coordination</H3>
	
	In this example coordination information are passed over a given IOGraph.
	In the IOGraph it is specified to which agents coordination events observed in a specified agent should be passed.
-->

<applicationtype xmlns="http://jadex.sourceforge.net/jadex"
	xmlns:env="http://jadex.sourceforge.net/jadex-envspace"
	xmlns:xsi="http://www.w3.org/2001/XMLSchema-instance"
	xsi:schemaLocation="http://jadex.sourceforge.net/jadex-application 
	                    http://jadex.sourceforge.net/jadex-application-2.0.xsd	                    
	                    http://jadex.sourceforge.net/jadex-envspace 
	                    http://jadex.sourceforge.net/jadex-envspace-2.0.xsd"
	name="IOGraph" package="deco4mas.examples.iograph">	

	<imports>
		<import>jadex.extension.envsupport.environment.space2d.*</import>
		<import>jadex.extension.envsupport.environment.*</import>
		<import>jadex.extension.envsupport.math.*</import>
		<import>jadex.extension.envsupport.dataview.*</import>
		<import>jadex.extension.envsupport.observer.perspective.*</import>
		<import>jadex.bdi.planlib.*</import>
		<import>jadex.bridge.service.*</import>
		<import>jadex.commons.future.*</import>
		<import>deco4mas.coordinate.interpreter.coordination_information.*</import>
		<import>deco4mas.coordinate.environment.*</import>
		<import>deco4mas.annotation.agent.*</import>
		<import>deco4mas.coordinate.*</import>
		<import>deco4mas.examples.iograph.*</import>
	</imports>	

			
	<extensiontypes>
		<env:envspacetype name="coordspace" width="11" height="11" class="CoordinationSpace">		
			<env:property name="dynamics_configuration">"sodekovs-coordination/src/main/java/deco4mas/examples/iograph/iograph.dynamics.xml"</env:property>

			<env:spaceexecutor class="DeltaTimeExecutor">
				<env:property name="space">$space</env:property>
				<env:property name="tick">true</env:property>
			</env:spaceexecutor>
		</env:envspacetype>
	</extensiontypes>
	
	<componenttypes>
		<componenttype name="Graph" filename="deco4mas/examples/iograph/GraphAgent.class" />
		<componenttype name="BDIGraph" filename="deco4mas/examples/iograph/BDIGraph.agent.xml" />
	</componenttypes>


	<applications>
	
	<application name="IOGraphTest">
			<extensions>	
				<env:envspace name="mycoordspace" type="coordspace" width="2" height ="2" />
			</extensions>
			<components>
				<component type="Graph">
					<arguments>
						<argument name="graphId">"1"</argument>
					</arguments>
				</component>
				<component type="Graph">
					<arguments>
						<argument name="graphId">"2"</argument>
					</arguments>
				</component>
				<component type="BDIGraph">
					<arguments>
						<argument name="graphId">"3"</argument>
					</arguments>
				</component>
				<component type="Graph">
					<arguments>
						<argument name="graphId">"4"</argument>
					</arguments>
				</component>
			</components>
 		</application>
	</applications>
	
</applicationtype>