<?xml version="1.0" encoding="UTF-8"?>
<!--
	<H3>Production line scenario application descriptor</H3>
-->
<applicationtype xmlns="http://jadex.sourceforge.net/jadex"
	xmlns:env="http://jadex.sourceforge.net/jadex-envspace"
	xmlns:xsi="http://www.w3.org/2001/XMLSchema-instance"
	xsi:schemaLocation="http://jadex.sourceforge.net/jadex-application 
	                    http://jadex.sourceforge.net/jadex-application-2.0.xsd	                    
	                    http://jadex.sourceforge.net/jadex-envspace 
	                    http://jadex.sourceforge.net/jadex-envspace-2.0.xsd"
	name="ProductionLine" package="haw.mmlab.production_line">
	
	<imports>
		<import>jadex.extension.envsupport.environment.space2d.*</import>
		<import>jadex.extension.envsupport.environment.*</import>
		<import>jadex.extension.envsupport.math.*</import>
		<import>jadex.extension.envsupport.dataview.*</import>
		<import>jadex.extension.envsupport.observer.perspective.*</import>
		<import>jadex.bdi.planlib.*</import>
		<import>jadex.bridge.service.*</import>
		<import>jadex.commons.future.*</import>
		<import>deco4mas.coordinate.interpreter.coordination_information.*</import>
		<import>deco4mas.coordinate.environment.*</import>
		<import>deco4mas.annotation.agent.*</import>
		<import>deco4mas.coordinate.*</import>
		<import>haw.mmlab.production_line.manager.*</import>
		<import>haw.mmlab.production_line.robot.*</import>
		<import>haw.mmlab.production_line.transport.*</import>
		<import>haw.mmlab.production_line.timelord.*</import>
		<import>haw.mmlab.production_line.service.*</import>
	</imports>
	
	<extensiontypes>
		<env:envspacetype name="coordspace" width="11" height="11" class="CoordinationSpace">		
			<env:property name="dynamics_configuration">"src/main/java/haw/mmlab/production_line/coordination.dynamics.xml"</env:property>

			<env:spaceexecutor class="DeltaTimeExecutor">
				<env:property name="space">$space</env:property>
				<env:property name="tick">true</env:property>
			</env:spaceexecutor>
			
		</env:envspacetype>
	</extensiontypes>
	
	<componenttypes>
		<componenttype name="Manager" filename="haw/mmlab/production_line/manager/ManagerAgent.class"/>
		<componenttype name="Transport" filename="haw/mmlab/production_line/transport/TransportAgent.class"/>
		<componenttype name="Robot" filename="haw/mmlab/production_line/robot/RobotAgent.class"/>
		<componenttype name="Timelord" filename="haw/mmlab/production_line/timelord/TimelordAgent.class"/>
		<componenttype name="Dropout" filename="haw/mmlab/production_line/dropout/DropoutAgent.class"/>
	</componenttypes>
	
	<applications>
		<application name="Default">
			<extensions>	
				<env:envspace name="mycoordspace" type="coordspace" width="2" height ="2" />
			</extensions>		
			<components>
				<component type="Manager">
					<arguments>
						<argument name="configuration_model">"conf/generated.conf.xml"</argument>
						<argument name="dropout_configuration_model">"conf/dropout.conf.xml"</argument>
						<argument name="strategy">"hybridStrategy"</argument>
					</arguments>
				</component>
			</components>
 		</application>
	</applications>
</applicationtype>